{
  "schemaVersion": "1.0.0",
  "planId": "ENGPLAN-CYCLE-EVT-20260803-001",
  "workstreamId": "WS-15",
  "ownerRole": "ENG-15",
  "producerActorId": "actor-eng-15",
  "status": "failed",
  "verificationDisposition": "failed",
  "implementationRevision": "pending",
  "changedComponents": [],
  "commands": [
    "Get-Content -Raw -LiteralPath '.development-os\\runs\\ENGPLAN-CYCLE-EVT-20260803-001-WS-15-input.json'",
    "git status --short; git diff --stat; git diff --check; rg --files -g '!node_modules' -g '!.git'",
    "Get-ChildItem -Recurse -File -LiteralPath docs,tests; read WS-01 through WS-14 result JSON files",
    "pwsh -NoProfile -File tests\\quality\\validate-planning-evidence.ps1; git diff --check",
    "Parsed WS-01 through WS-14 result files and all docs JSON files with ConvertFrom-Json; inspected scoped git status",
    "Inspected executable roots, package manifests, and documentation mentions of sepehr-product-owner"
  ],
  "evidence": [
    "All 14 dependency result records report completed, and all 14 documentation artifacts parse as JSON and trace to DEVREQ-CYCLE-EVT-20260803-001 and ENGPLAN-CYCLE-EVT-20260803-001.",
    "The planning-evidence contract suite passed with 12 records inspected and zero failures. It confirmed a single shared Download domain owner, explicitly unapproved architecture, ENG-15 verifier reservation, and traceability for seven canonical states.",
    "git diff --check exited successfully; its only output was an LF-to-CRLF warning for engineering/taskboard/workstreams.csv.",
    "No executable source roots, package.json, or package-lock.json exist. Therefore application behavior, runtime integration, accessibility, resilience, performance, security controls, packaging, and release behavior cannot be independently reproduced.",
    "The repository contains planning and review artifacts, but no dated human product-decision record supporting the required primary segment, initial platform, bounded MVP, differentiation, exclusions, or meaning of all devices. Documentation references to sepehr-product-owner are not evidence of such a decision.",
    "The request's material acceptance claims are therefore not fully supported. The passing planning-contract test is narrower than AC-01 through AC-30 and cannot justify an overall passed disposition.",
    "No files were edited by this read-only verification run."
  ],
  "knownRisks": [
    "Implementation planning remains blocked by missing human-approved product scope and discovery evidence.",
    "No executable application or runtime tests exist, so user-visible and nonfunctional behavior remains unverified.",
    "License, dependency governance, vulnerability reporting, signing custody, release ownership, and public-distribution readiness remain unresolved.",
    "The worktree already contains untracked planning artifacts and a modified engineering/taskboard/workstreams.csv; these were inspected but not changed."
  ],
  "completedAt": "2026-08-03T17:42:26.7816332+03:30"
}
