{
  "schemaVersion": "1.0.0",
  "planId": "ENGPLAN-CYCLE-EVT-20260803-002",
  "workstreamId": "WS-01",
  "ownerRole": "ENG-01",
  "producerActorId": "actor-eng-01",
  "status": "completed",
  "verificationDisposition": "not_applicable",
  "implementationRevision": "pending",
  "changedComponents": [
    "docs/engineering-coordination/DEVREQ-CYCLE-EVT-20260803-002-workstream-sequence.json"
  ],
  "commands": [
    "Get-Content -Raw C:\\Users\\sepehr\\.agents\\skills\\dan-agent-accuracy\\SKILL.md",
    "Read workstream input, repository instructions, plan, schema, file map, and Git status with PowerShell Get-Content/Get-ChildItem and git status --short",
    "Read the previous coordination record, DEVELOPMENT.md, and planning-evidence validator with PowerShell Get-Content",
    "Applied a patch adding docs/engineering-coordination/DEVREQ-CYCLE-EVT-20260803-002-workstream-sequence.json",
    "Parsed the coordination JSON and checked AC-01 through AC-30 traceability, shared-domain ownership, and ENG-15 reservation with PowerShell",
    "git diff --check",
    "git diff -- docs/engineering-coordination/DEVREQ-CYCLE-EVT-20260803-002-workstream-sequence.json",
    "git status --short",
    "Get-FileHash -Algorithm SHA256 docs/engineering-coordination/DEVREQ-CYCLE-EVT-20260803-002-workstream-sequence.json"
  ],
  "evidence": [
    "Coordination artifact parsed successfully with requestId DEVREQ-CYCLE-EVT-20260803-002 and planId ENGPLAN-CYCLE-EVT-20260803-002.",
    "Inspectable result contains 6 delivery stages, 14 dependency entries, and 3 explicit blockers.",
    "Traceability check found no missing criteria among AC-01 through AC-30.",
    "Artifact records one shared Rust domain/service owner for business rules and reserves independent disposition for ENG-15.",
    "git diff --check exited 0.",
    "SHA-256: 9D2FC1029E26B7197313AA07A408A6D56B80E22D55EDC8A4B05E035B17971785.",
    "Git status confirmed the only WS-01-created path is docs/engineering-coordination/DEVREQ-CYCLE-EVT-20260803-002-workstream-sequence.json; pre-existing orchestration and taskboard changes were not modified."
  ],
  "knownRisks": [
    "The approved request requires root Cargo.toml and LICENSE files, but the authoritative allowedPaths do not permit either root path.",
    "The repository still has no Rust/Tauri application source; buildability and product behavior remain downstream responsibilities.",
    "HTTP server variance, restart-safe persistence, byte-correct assembly, Windows path rules, shell actions, and clipboard privacy remain high-risk implementation areas.",
    "Independent verification remains pending for ENG-15."
  ],
  "completedAt": "2026-08-03T18:11:28.7680658+03:30"
}
