{
  "schemaVersion": "1.0.0",
  "planId": "ENGPLAN-CYCLE-EVT-20260803-001",
  "workstreamId": "WS-01",
  "ownerRole": "ENG-01",
  "producerActorId": "actor-eng-01",
  "status": "blocked",
  "verificationDisposition": "not_applicable",
  "implementationRevision": "pending",
  "changedComponents": [],
  "commands": [
    "Get-Content -Raw -LiteralPath '.development-os\\runs\\ENGPLAN-CYCLE-EVT-20260803-001-WS-01-input.json'",
    "Get-Content -Raw -LiteralPath 'C:\\Users\\sepehr\\.agents\\skills\\dan-agent-accuracy\\SKILL.md'",
    "git diff --check",
    "git status --short"
  ],
  "evidence": [
    "The workstream input was read successfully and identifies WS-01 as engineering coordination with an approved repository write boundary.",
    "Repository modification was unavailable because the active filesystem permission profile permits read access only; no assigned deliverables could be written.",
    "git diff --check exited successfully with only an existing LF-to-CRLF warning for engineering/taskboard/workstreams.csv.",
    "git status --short showed pre-existing modified and untracked orchestration files; none were changed by this workstream run."
  ],
  "knownRisks": [
    "The engineering coordination deliverables remain unimplemented until this workstream is rerun with write access to the allowed paths.",
    "The working tree contains pre-existing changes outside the assigned write boundary that must remain isolated from this workstream."
  ],
  "completedAt": "2026-08-03T16:30:00+03:30"
}
