{
  "schemaVersion": "1.0.0",
  "planId": "ENGPLAN-CYCLE-EVT-20260803-002",
  "workstreamId": "WS-15",
  "ownerRole": "ENG-15",
  "producerActorId": "actor-eng-15",
  "status": "failed",
  "verificationDisposition": "failed",
  "implementationRevision": "pending",
  "changedComponents": [],
  "commands": [
    "Get-Content -Raw C:\\Users\\sepehr\\.agents\\skills\\dan-agent-accuracy\\SKILL.md; Get-Content -Raw .development-os\\runs\\ENGPLAN-CYCLE-EVT-20260803-002-WS-15-input.json",
    "git status --short; git rev-parse HEAD; rg --files -g '!node_modules' -g '!.git' | Sort-Object; Get-Content -Raw package.json; Get-Content -Raw Cargo.toml",
    "Get-ChildItem -Recurse -File apps,packages,src,tests,.github | Select-Object -ExpandProperty FullName; Get-Content -Raw tests\\quality\\verify-windows-delivery.ps1; Get-Content -Raw apps\\desktop\\src-tauri\\Cargo.toml; Get-Content -Raw packages\\download-engine\\Cargo.toml",
    "cargo test --manifest-path packages\\download-engine\\Cargo.toml",
    "node --test tests\\frontend\\*.test.js",
    "powershell -NoProfile -File tests\\quality\\verify-windows-delivery.ps1 -Mode Check",
    "powershell -NoProfile -File tests\\quality\\verify-windows-delivery.ps1 -Mode Build; git diff --check; Get-Content -TotalCount 5 LICENSE; Get-Content -Raw apps\\desktop\\Cargo.toml; Get-Content -Raw packages\\download-engine\\Cargo.toml",
    "Get-Date -Format o; Test-Path Cargo.toml; Test-Path LICENSE; git status --short -- apps packages src tests package.json LICENSE Cargo.toml"
  ],
  "evidence": [
    "Canonical inspected Git revision was 1c2efa69d7c6f8878fee4448a5f46aac52d2e3f3; implementation files were untracked in the inspected worktree.",
    "cargo test --manifest-path packages\\download-engine\\Cargo.toml passed six behavioral integration tests, including byte-correct segmented and fallback downloads, persisted pause/resume, cancellation, restart recovery, and filename containment.",
    "node --test tests\\frontend\\*.test.js passed two tests, but they only covered transfer-metric formatting and canonical-state labels; they did not exercise a real DOM or Windows runtime.",
    "verify-windows-delivery.ps1 -Mode Check exited 0 after npm tests, cargo formatting checks, six Rust runtime tests, and cargo check for apps/desktop/Cargo.toml.",
    "verify-windows-delivery.ps1 -Mode Build exited 0 and cargo build --manifest-path apps/desktop/Cargo.toml --locked completed successfully.",
    "apps\\desktop\\Cargo.toml consumes download-engine through path ../../packages/download-engine; the engine manifest uses tokio and reqwest.",
    "git diff --check produced no whitespace-error output.",
    "Test-Path Cargo.toml returned False, so the required root Rust workspace manifest is absent.",
    "Test-Path LICENSE returned False, and direct LICENSE inspection failed because the required root GPL-3.0 license file is absent.",
    "No real-DOM, Windows UI, keyboard-only, screen-reader, clipboard, destination-picker, open-file, or reveal-in-folder runtime evidence was reproduced."
  ],
  "knownRisks": [
    "AC-01/AC-12/AC-25/AC-29 are not satisfied because the repository lacks both a root Cargo.toml workspace manifest and the required root GPL-3.0 LICENSE.",
    "Material user-visible claims for queue behavior, lifecycle controls, clipboard offers, destination selection, file actions, keyboard operation, and assistive technology remain unsupported by equivalent runtime tests.",
    "The reproduced engine suite does not explicitly identify a deterministic simulated network-interruption transfer test distinct from persisted pause/resume and manifest recovery.",
    "The implementation under apps, packages, src, and tests was untracked, so Git HEAD alone does not canonically identify the verified content."
  ],
  "completedAt": "2026-08-03T20:40:42.2224128+03:30"
}
