{
  "schemaVersion": "1.0.0",
  "planId": "ENGPLAN-CYCLE-EVT-20260803-001",
  "workstreamId": "WS-11",
  "ownerRole": "ENG-11",
  "producerActorId": "actor-eng-11",
  "status": "completed",
  "verificationDisposition": "not_applicable",
  "implementationRevision": "80e5b2d6b1fb3a3efac1063eae1062a51a00f2d21f6fd70b77bd30412e8a08bc",
  "changedComponents": [
    "docs/sre-observability-performance/DEVREQ-CYCLE-EVT-20260803-001-sre-observability-performance-plan.json"
  ],
  "commands": [
    "Get-Content -Raw 'C:\\Users\\sepehr\\.agents\\skills\\dan-agent-accuracy\\SKILL.md'; Get-Content -Raw '.development-os\\runs\\ENGPLAN-CYCLE-EVT-20260803-001-WS-11-input.json'",
    "Repository inspection using Get-ChildItem, git status --short, and reads of README.md, DEVELOPMENT.md, the WS-02 architecture record, and the WS-08 platform review",
    "Parsed the artifact with ConvertFrom-Json; validated identifiers, five service objectives, five performance cases, six recovery cases, privacy-safe telemetry defaults, prohibited diagnostic fields, zero runtime-evidence claims, and the shared business-rule boundary; ran git diff --check and git diff --no-index --check; calculated SHA-256 and byte length; inspected artifact status",
    "Get-Date -Format o"
  ],
  "evidence": [
    "Created a machine-readable SRE, observability, performance, and recovery plan covering service objectives, local diagnostics, opt-in requirements for any future remote telemetry, cardinality controls, performance workloads, recovery fault injection, evidence capture, and operational signals.",
    "Validation passed: 5 service objectives, 5 performance cases, 6 recovery cases, and 5 telemetry event definitions.",
    "The plan explicitly keeps state transitions, retry, resume, cancellation, destination, finalization, and recovery rules in the shared download domain and transfer service; telemetry and other adapters only observe facts.",
    "Security/privacy review evidence: remote telemetry is absent by default, diagnostic fields use an allow-listed envelope, and raw URLs, authorization data, cookies, credentials, paths, filenames, contents, IP addresses, and stable device identifiers are prohibited.",
    "Performance and recovery evidence is accurately recorded as unavailable: the repository has no executable application, approved first platform, approved workload, or numerical resource baseline. Candidate targets are labeled unmeasured rather than presented as achieved results.",
    "No user-visible behavior was implemented, so DOM, browser, integration, or equivalent runtime testing was not applicable.",
    "git diff --check and the new-file whitespace check passed.",
    "Artifact SHA-256: a3afe510d7b62d993ad6947492ab8a77500adf7b6d2fd66f11d318ee6b9dd190; size: 13218 bytes."
  ],
  "knownRisks": [
    "The first platform, supported versions, MVP workload, UI foundation, and numerical resource ceilings remain unapproved.",
    "Candidate latency values are planning targets, not measured commitments, and require recalibration on approved platform hardware.",
    "No executable transfer, persistence, filesystem, or UI implementation exists, so performance and recovery outcomes remain unverified.",
    "Diagnostic retention and export behavior require a privacy decision before implementation.",
    "Range and remote-identity mistakes could silently corrupt content unless the mandatory recovery matrix is automated.",
    "Independent verification remains outstanding and may only be issued by ENG-15."
  ],
  "completedAt": "2026-08-03T17:14:50.9880652+03:30"
}
