{
  "schemaVersion": "1.0.0",
  "planId": "ENGPLAN-CYCLE-EVT-20260803-001",
  "workstreamId": "WS-01",
  "ownerRole": "ENG-01",
  "producerActorId": "actor-eng-01",
  "status": "blocked",
  "verificationDisposition": "not_applicable",
  "implementationRevision": "pending",
  "changedComponents": [],
  "commands": [
    "Get-Content -Raw 'C:\\Users\\sepehr\\.agents\\skills\\dan-agent-accuracy\\SKILL.md'",
    "Get-Content -Raw '.development-os\\runs\\ENGPLAN-CYCLE-EVT-20260803-001-WS-01-input.json'"
  ],
  "evidence": [
    "Both read attempts failed before execution because the Windows sandbox helper could not launch: codex-windows-sandbox-setup.exe was not found.",
    "No repository files were inspected or changed, and no verification could be run."
  ],
  "knownRisks": [
    "ownerRole could not be verified from the inaccessible input file; ENG-01 was inferred from the assigned actor identifier.",
    "The assigned workstream remains unimplemented until repository tool execution is restored."
  ],
  "completedAt": "2026-08-03T00:00:00+03:30"
}
