{
  "schemaVersion": "1.0.0",
  "planId": "ENGPLAN-CYCLE-EVT-20260803-001",
  "workstreamId": "WS-15",
  "ownerRole": "ENG-15",
  "producerActorId": "actor-eng-15",
  "status": "failed",
  "verificationDisposition": "failed",
  "implementationRevision": "pending",
  "changedComponents": [],
  "commands": [
    "Get-Content -Raw -LiteralPath '.development-os\\runs\\ENGPLAN-CYCLE-EVT-20260803-001-WS-15-input.json'",
    "git status --short; git diff --check; git diff --stat; git diff --cached --stat; rg --files -g '!node_modules'",
    "Get-ChildItem -Recurse -File docs,tests | Select-Object FullName,Length; if (Test-Path package.json) { Get-Content -Raw package.json }; Get-ChildItem -LiteralPath '.development-os\\runs' -Filter 'ENGPLAN-CYCLE-EVT-20260803-001-WS-*-result.json' | Sort-Object Name | ForEach-Object { \"### $($_.Name)\"; Get-Content -Raw $_.FullName }",
    "pwsh -NoProfile -File tests\\quality\\validate-planning-evidence.ps1; git diff --check",
    "PowerShell audit of all docs JSON records, WS-01 through WS-14 result status and artifact presence, and decision-evidence terms",
    "PowerShell audit of documentation status fields and blocked/unapproved/absent evidence",
    "git rev-parse HEAD; git status --short -- docs tests package.json package-lock.json; Get-Date -Format o"
  ],
  "evidence": [
    "Canonical inspected Git revision: afa80b80c5becf74b7620d62c50ff1ee00babefe.",
    "All WS-01 through WS-14 result records report completed, and every declared artifact was present.",
    "The planning-evidence contract suite passed with 12 records inspected and zero failures; it confirmed request/plan traceability, a single shared Download domain owner, proposed-blocked architecture, ENG-15 verifier reservation, and the seven canonical states.",
    "git diff --check exited successfully, with only a line-ending warning for the pre-existing engineering/taskboard/workstreams.csv modification.",
    "Independent inspection found 14 JSON planning records, but their statuses explicitly report pending human decisions and blocked implementation, runtime validation, automation, or release readiness.",
    "The architecture record explicitly reports AC-01, AC-10, AC-11, AC-13, AC-21, and AC-26 blocked pending a human product-owner record and states that discovery evidence is missing.",
    "No executable application, real DOM/native runtime, or behavioral implementation was present; therefore the material user-visible, resilience, accessibility, security, compatibility, and performance acceptance claims could not be reproduced.",
    "Scoped Git status showed docs/ and tests/ as untracked. No files were edited during this verification run."
  ],
  "knownRisks": [
    "The planning validator proves internal planning-contract consistency, not satisfaction of all 30 product acceptance criteria.",
    "The required dated human product decision, approved product brief, and discovery evidence are absent.",
    "Architecture, first platform, supported versions, bounded MVP, license, governance, signing, updates, and release ownership remain unresolved.",
    "Runtime behavior for download state transitions, restart recovery, destination handling, integrity, accessibility, security, compatibility, and performance remains unimplemented and unverified.",
    "The implementation evidence is untracked, so canonical revision afa80b80c5becf74b7620d62c50ff1ee00babefe does not contain the inspected docs and tests."
  ],
  "completedAt": "2026-08-03T17:30:53.3144475+03:30"
}
