{
  "schemaVersion": "1.0.0",
  "planId": "ENGPLAN-CYCLE-EVT-20260803-001",
  "workstreamId": "WS-01",
  "ownerRole": "ENG-01",
  "producerActorId": "actor-eng-01",
  "status": "blocked",
  "verificationDisposition": "not_applicable",
  "implementationRevision": "pending",
  "changedComponents": [],
  "commands": [
    "Get-Content -Raw 'C:\\Users\\sepehr\\.agents\\skills\\dan-agent-accuracy\\SKILL.md'; Get-Content -Raw '.development-os\\runs\\ENGPLAN-CYCLE-EVT-20260803-001-WS-01-input.json'",
    "Get-Content -Raw '.development-os\\runs\\ENGPLAN-CYCLE-EVT-20260803-001-WS-01-input.json'"
  ],
  "evidence": [
    "Both repository-read attempts failed before execution because the Windows sandbox helper codex-windows-sandbox-setup.exe was unavailable (orchestrator_helper_launch_failed).",
    "No repository files were read or changed, and no verification could be run."
  ],
  "knownRisks": [
    "The input's actual ownerRole, writeBoundary, policy, and assigned implementation could not be inspected; ownerRole is therefore unverified.",
    "The assigned workstream remains unimplemented and unverified."
  ],
  "completedAt": "2026-08-03T00:00:00+03:30"
}
