{
  "schemaVersion": "1.0.0",
  "planId": "ENGPLAN-CYCLE-EVT-20260803-001",
  "workstreamId": "WS-12",
  "ownerRole": "ENG-12",
  "producerActorId": "actor-eng-12",
  "status": "completed",
  "verificationDisposition": "not_applicable",
  "implementationRevision": "80e5b2d6b1fb3a3efac1063eae1062a51a00f2d21f6fd70b77bd30412e8a08bc",
  "changedComponents": [
    "docs/developer-experience-delivery/DEVREQ-CYCLE-EVT-20260803-001-developer-experience-delivery-plan.json"
  ],
  "commands": [
    "Read the complete dan-agent-accuracy SKILL.md and WS-12 input using Get-Content -Raw.",
    "Inspected repository instructions, files, working-tree status, the WS-02 result, workstream plan, architecture record, and platform review using Get-Content, Get-ChildItem, and git status --short.",
    "Parsed and validated the delivery-plan JSON with ConvertFrom-Json; asserted request/workstream identity, architecture traceability, CI controls, release stages, readiness gates, shared-domain guidance, runtime-test requirements, secret controls, immutability, and ENG-15 ownership; ran git diff --check and git diff --no-index --check.",
    "Ran git diff --no-index --stat, inspected security and release-control fields, calculated SHA-256 and byte length, and inspected artifact status."
  ],
  "evidence": [
    "Created a machine-readable developer-experience and delivery plan covering repository boundaries, local command interfaces, CI gates, runner isolation, immutable artifact promotion, staged release controls, supply-chain security, secrets, developer onboarding, test levels, and release-readiness gates.",
    "The plan preserves one shared download domain/service implementation for business rules and requires all UI and platform adapters to consume it.",
    "Automated validation passed: 4 architecture decisions traced, 6 pull-request gates, 4 release stages, 6 readiness gates, and 6 acceptance-traceability groups.",
    "Security inspection found 4 explicit secret controls and a pull-request gate for vulnerability and secret scanning; pull-request jobs are specified as credential-free and unable to publish or sign.",
    "Release automation remains intentionally uncreated because no approved stack, lockfile, executable source, or test runner exists; signing and publication remain blocked by ADR-04 and separate human approval.",
    "git diff --check and new-file whitespace validation passed. The implementation diff contains 1 file with 116 insertions.",
    "Artifact SHA-256: 0bef55808de87db57840cc778b2fefbecdca63741c294746fd01b2590b49cdc1; size: 12249 bytes.",
    "No user-visible behavior was implemented, so DOM, browser, integration, or equivalent runtime testing was not applicable."
  ],
  "knownRisks": [
    "Product, platform, UI foundation, language, package manager, persistence, and packaging decisions remain unresolved, preventing truthful executable CI configuration.",
    "License, dependency policy, governance, vulnerability reporting, release ownership, and signing custody remain blockers to public source or binary release.",
    "Cross-platform packaging, filesystem, accessibility, signing, and rollback behavior still require native runners and assigned platform owners.",
    "No executable application, lockfile, tests, package, or runtime exists, so quality, resilience, accessibility, performance, security, and reproducibility outcomes remain unverified.",
    "Independent engineering verification remains outstanding and may only be issued by ENG-15."
  ],
  "completedAt": "2026-08-03T17:17:44.1813328+03:30"
}
