{
  "schemaVersion": "1.0.0",
  "planId": "ENGPLAN-CYCLE-EVT-20260803-002",
  "workstreamId": "WS-10",
  "ownerRole": "ENG-10",
  "producerActorId": "actor-eng-10",
  "status": "completed",
  "verificationDisposition": "not_applicable",
  "implementationRevision": "pending",
  "changedComponents": [
    "tests/quality/run-regression.ps1"
  ],
  "commands": [
    "powershell -NoProfile -File tests\\quality\\run-regression.ps1 -Mode Check -ReportPath \"$env:TEMP\\sandwich-ws10-regression.json\"",
    "Get-Content -Raw \"$env:TEMP\\sandwich-ws10-regression.json\"",
    "git diff --check"
  ],
  "evidence": [
    "Machine-readable regression report completed with status passed in 3662 ms and traceability to DEVREQ-CYCLE-EVT-20260803-002.",
    "Node.js runtime tests passed: 2 passed, 0 failed.",
    "Rust download-engine behavioral tests passed: 4 passed, 0 failed, including controlled Range transfer, non-Range fallback, byte integrity, manifest recovery, metrics, and filename containment.",
    "cargo fmt --check passed for the shared download-engine crate.",
    "cargo check passed for the Windows Tauri desktop adapter consuming the shared engine.",
    "git diff --check exited successfully."
  ],
  "knownRisks": [
    "The regression suite checks formatter logic but does not provide real-DOM or Windows desktop runtime evidence for queue interaction, clipboard offers, keyboard operation, screen readers, or shell actions.",
    "Existing engine tests recover persisted manifest state but do not execute a complete pause, cancel, network-interruption, and resumed-transfer lifecycle.",
    "Independent engineering verification remains outstanding and is reserved for ENG-15."
  ],
  "completedAt": "2026-08-03T19:47:13.7733254+03:30"
}
