{
  "schemaVersion": "1.0.0",
  "planId": "ENGPLAN-CYCLE-EVT-20260803-001",
  "workstreamId": "WS-15",
  "ownerRole": "ENG-15",
  "producerActorId": "actor-eng-15",
  "status": "failed",
  "verificationDisposition": "failed",
  "implementationRevision": "pending",
  "changedComponents": [],
  "commands": [
    "Get-Content -Raw -LiteralPath '.development-os\\runs\\ENGPLAN-CYCLE-EVT-20260803-001-WS-15-input.json'",
    "git status --short; rg --files -g '!node_modules' -g '!.git'; if (Test-Path -LiteralPath 'package.json') { Get-Content -Raw -LiteralPath 'package.json' }; git diff --stat; git ls-files --others --exclude-standard",
    "Get-ChildItem -LiteralPath 'docs','tests' -Recurse -File; Get-ChildItem -LiteralPath '.development-os\\runs' -Filter 'ENGPLAN-CYCLE-EVT-20260803-001-WS-*-result.json'; if (Test-Path -LiteralPath 'package.json') { Get-Content -Raw -LiteralPath 'package.json' }; git diff --check",
    "Get-Content -Raw -LiteralPath 'tests\\quality\\validate-planning-evidence.ps1'; pwsh -NoProfile -File 'tests\\quality\\validate-planning-evidence.ps1'; PowerShell audit of WS-01 through WS-14 results, declared components, documentation JSON count, executable application files, package manifest, and decision-evidence terms; git rev-parse HEAD; git status --short -- docs tests package.json package-lock.json; git diff --check; Get-Date -Format o"
  ],
  "evidence": [
    "Canonical inspected Git revision: afa80b80c5becf74b7620d62c50ff1ee00babefe.",
    "All WS-01 through WS-14 result records reported completed, and all declared components were present.",
    "The planning-evidence contract suite passed with 12 records inspected and zero failures. It reproduced request/plan traceability, one shared Download domain owner, proposed-blocked architecture status, ENG-15 verifier reservation, and planning references for seven canonical download states.",
    "Independent audit found 14 documentation JSON files, zero executable application files under src, app, apps, packages, or services, and no package.json.",
    "No real DOM, native application runtime, integration implementation, or equivalent behavioral target exists; user-visible download behavior and the material resilience, accessibility, security, compatibility, and performance claims therefore could not be reproduced.",
    "The inspected architecture remains explicitly proposed and blocked pending human decisions; repository documentation contains 65 references to blocked, pending-human-decision, missing-discovery-evidence, or human-product-owner conditions.",
    "git diff --check exited successfully with only a line-ending warning for the existing engineering/taskboard/workstreams.csv modification.",
    "Scoped Git status showed docs/ and tests/ as untracked, so canonical revision afa80b80c5becf74b7620d62c50ff1ee00babefe does not contain the inspected implementation evidence.",
    "No repository files were modified during this verification run."
  ],
  "knownRisks": [
    "The passing planning validator establishes internal planning-record consistency, not satisfaction of the 30 product acceptance criteria.",
    "Required dated human product decisions, an approved product brief, and discovery evidence remain absent.",
    "The first platform, bounded MVP, supported versions, license, governance, signing, update strategy, and release ownership remain unresolved.",
    "Download state transitions, restart recovery, destination handling, file integrity, accessibility, security, compatibility, and performance remain unimplemented and behaviorally unverified.",
    "The implementation evidence is untracked and therefore is not part of the canonical inspected revision."
  ],
  "completedAt": "2026-08-03T17:32:57.5493791+03:30"
}
