{
  "schemaVersion": "1.0.0",
  "planId": "ENGPLAN-CYCLE-EVT-20260803-002",
  "workstreamId": "WS-09",
  "ownerRole": "ENG-09",
  "producerActorId": "actor-eng-09",
  "status": "completed",
  "verificationDisposition": "not_applicable",
  "implementationRevision": "pending",
  "changedComponents": [
    "docs/security-privacy-compliance/DEVREQ-CYCLE-EVT-20260803-002-security-review.json"
  ],
  "commands": [
    "Get-Content -Raw C:\\Users\\sepehr\\.agents\\skills\\dan-agent-accuracy\\SKILL.md; Get-Content -Raw .development-os\\runs\\ENGPLAN-CYCLE-EVT-20260803-002-WS-09-input.json",
    "git status --short; rg --files -g 'AGENTS.md' -g 'CLAUDE.md' -g '.env.example' -g 'README*' -g 'Cargo.toml' -g 'package.json' -g 'docs/**' -g 'src/**' -g 'app/**' -g 'apps/**' -g 'packages/**' -g 'services/**' -g 'tests/**' -g '.github/**'",
    "Get-Content -Raw apps\\desktop\\Cargo.toml; Get-Content -Raw packages\\download-engine\\Cargo.toml; Get-Content -Raw apps\\desktop\\src\\main.rs; Get-ChildItem packages\\download-engine\\src -File | ForEach-Object { Get-Content -Raw $_.FullName }; Get-Content -Raw docs\\architecture\\DEVREQ-CYCLE-EVT-20260803-002-solution-architecture.json",
    "Get-Content -Raw apps\\desktop\\tauri.conf.json; Get-ChildItem apps\\desktop\\capabilities -File -ErrorAction SilentlyContinue | ForEach-Object { Get-Content -Raw $_.FullName }; cargo tree --manifest-path apps\\desktop\\Cargo.toml --duplicates; cargo audit --version",
    "Get-Content -Raw docs\\security-privacy-compliance\\DEVREQ-CYCLE-EVT-20260803-002-security-review.json | ConvertFrom-Json; cargo test --manifest-path packages\\download-engine\\Cargo.toml; cargo tree --manifest-path apps\\desktop\\Cargo.toml --locked --duplicates; git diff --check"
  ],
  "evidence": [
    "Created an inspectable security, privacy, compliance, threat-model, supply-chain, and acceptance-criteria traceability record containing 7 findings and 4 release-blocking findings.",
    "The security-review JSON parsed successfully and reported recordId SEC-DEVREQ-CYCLE-EVT-20260803-002, 7 findings, 4 blockers, and a distribution-blocking disposition.",
    "cargo test --manifest-path packages\\download-engine\\Cargo.toml passed all 4 behavioral integration tests, including byte-correct segmented/fallback downloads, restart recovery, filename containment, manifest validation, and backup/restore.",
    "cargo tree --manifest-path apps\\desktop\\Cargo.toml --locked --duplicates completed successfully and supplied resolved dependency evidence including Tauri 2.11.5, reqwest 0.12.28, rustls 0.23.43, tokio 1.53.1, and arboard 3.6.1.",
    "git diff --check completed successfully; its only output was pre-existing LF-to-CRLF warnings for .gitignore and engineering/taskboard/workstreams.csv.",
    "cargo audit --version terminated with an unavailable-command error, recorded as a supply-chain evidence limitation."
  ],
  "knownRisks": [
    "SEC-001: response bodies are buffered without explicit size or timeout limits, enabling memory exhaustion or indefinitely stalled transfers.",
    "SEC-002: parallel segments are not bound to a common remote-object validator, so length-correct mixed-version content may evade integrity checks.",
    "PRIV-001: full URLs, including potentially sensitive query parameters, are persisted and emitted to the webview and may appear in diagnostics.",
    "COMP-001: root GPL-3.0 text and automated dependency-license evidence were not available within this workstream's allowed write boundary.",
    "Automated RustSec advisory scanning remains pending because cargo-audit is not installed.",
    "Destination authorization, reparse-point containment, and local/private-network URL policy require remediation or explicit risk acceptance before distribution.",
    "Independent engineering verification remains reserved for ENG-15."
  ],
  "completedAt": "2026-08-03T19:44:34.9264679+03:30"
}
