{
  "schemaVersion": "1.0.0",
  "planId": "ENGPLAN-CYCLE-EVT-20260803-001",
  "workstreamId": "WS-15",
  "ownerRole": "ENG-15",
  "producerActorId": "actor-eng-15",
  "status": "blocked",
  "verificationDisposition": "blocked",
  "implementationRevision": "pending",
  "changedComponents": [],
  "commands": [
    "Get-Content -Raw -LiteralPath '.development-os\\runs\\ENGPLAN-CYCLE-EVT-20260803-001-WS-15-input.json'",
    "git status --short; git diff --check; git diff --stat; git diff --name-only; git ls-files --others --exclude-standard",
    "& 'tests\\quality\\validate-planning-evidence.ps1'",
    "Independent PowerShell contract check across 14 planning documents, 14 upstream results, shared-domain ownership, and security-review evidence",
    "Get-Date -Format o; git diff --check; git status --short -- docs tests"
  ],
  "evidence": [
    "Planning-evidence validator exited successfully and reported status=passed, recordsInspected=12, and no failures.",
    "Independent contract check passed for 14 traceable planning documents and 14 completed upstream workstream results.",
    "Architecture evidence contains exactly one shared Download domain owner.",
    "Security review is explicitly release-blocked and contains 8 threats and 7 security acceptance gates.",
    "git diff --check passed.",
    "Repository inspection found planning documents and one PowerShell planning-contract test, but no executable application or product-runtime tests.",
    "No files were modified by this read-only verification run."
  ],
  "knownRisks": [
    "A dated human product-owner decision approving the primary segment, first platform, bounded MVP, differentiation, exclusions, and meaning of all devices is absent.",
    "Discovery evidence required by the acceptance criteria is absent.",
    "No executable application exists; user-visible behavior, accessibility, resilience, integrity, performance, compatibility, and security controls cannot be independently reproduced.",
    "The planning validator checks planning-record presence and selected traceability properties; it does not establish implementation, QA, security, or release readiness.",
    "License, dependency policy, contribution governance, vulnerability reporting, signing custody, binary release ownership, and update ownership remain unresolved.",
    "The working tree contains pre-existing tracked and untracked orchestration and workstream artifacts; this verifier made no changes."
  ],
  "completedAt": "2026-08-03T17:34:28.5717116+03:30"
}
