{
  "schemaVersion": "1.0.0",
  "planId": "ENGPLAN-CYCLE-EVT-20260803-001",
  "workstreamId": "WS-01",
  "ownerRole": "ENG-01",
  "producerActorId": "actor-eng-01",
  "status": "blocked",
  "verificationDisposition": "not_applicable",
  "implementationRevision": "pending",
  "changedComponents": [],
  "commands": [
    "Get-Content -Raw -LiteralPath '.development-os\\runs\\ENGPLAN-CYCLE-EVT-20260803-001-WS-01-input.json'",
    "git status --short; rg --files -g '!node_modules' -g '!.git' | Select-Object -First 200",
    "apply_patch (attempted to add docs/engineering/ENGPLAN-CYCLE-EVT-20260803-001-WS-01.md)",
    "git diff --check"
  ],
  "evidence": [
    "The workstream input was read successfully and identified WS-01 as engineering coordination with repository writes allowed under docs and other listed paths.",
    "The documentation patch was rejected because the active filesystem sandbox is read-only and approval policy prevents enabling writes.",
    "No repository files were changed by this workstream.",
    "git diff --check exited 0; it reported only a pre-existing LF-to-CRLF warning for engineering/taskboard/workstreams.csv.",
    "Repository status showed a pre-existing modification to engineering/taskboard/workstreams.csv and pre-existing untracked .development-os orchestration artifacts; these were preserved.",
    "The combined repository inspection command exited 1 because rg is not installed, after git status completed successfully."
  ],
  "knownRisks": [
    "The required coordination record, owned workstream sequence, dependency/blocker register, traceability notes, and limitations could not be persisted.",
    "The workstream remains unimplemented until rerun with write access to the approved writeBoundary.",
    "Independent engineering verification remains required and may only be issued by ENG-15."
  ],
  "completedAt": "2026-08-03T00:00:00+03:30"
}
