{
  "schemaVersion": "1.0.0",
  "planId": "ENGPLAN-CYCLE-EVT-20260803-001",
  "workstreamId": "WS-10",
  "ownerRole": "ENG-10",
  "producerActorId": "actor-eng-10",
  "status": "completed",
  "verificationDisposition": "not_applicable",
  "implementationRevision": "80e5b2d6b1fb3a3efac1063eae1062a51a00f2d21f6fd70b77bd30412e8a08bc",
  "changedComponents": [
    "tests/quality/validate-planning-evidence.ps1",
    "docs/quality-test-automation/DEVREQ-CYCLE-EVT-20260803-001-quality-test-plan.json"
  ],
  "commands": [
    "pwsh -NoProfile -File tests\\quality\\validate-planning-evidence.ps1",
    "git diff --check",
    "git status --short -- tests docs\\quality-test-automation",
    "git diff -- tests\\quality\\validate-planning-evidence.ps1 docs\\quality-test-automation\\DEVREQ-CYCLE-EVT-20260803-001-quality-test-plan.json"
  ],
  "evidence": [
    "Planning-evidence contract suite passed with 12 records inspected and zero failures.",
    "All required planning records parsed as JSON and matched requestId DEVREQ-CYCLE-EVT-20260803-001 and planId ENGPLAN-CYCLE-EVT-20260803-001.",
    "Automated checks confirmed one shared Download domain owner, explicitly blocked/proposed architecture status, ENG-15 independent-verifier reservation, and traceability of all seven canonical download states.",
    "git diff --check exited successfully.",
    "git status identified only the new docs/quality-test-automation and tests paths within this workstream boundary."
  ],
  "knownRisks": [
    "The repository has no executable application, so application behavior, accessibility, resilience, performance, and security controls cannot yet receive runtime verification.",
    "The first platform, supported versions, implementation stack, persistence choice, and bounded MVP remain unapproved.",
    "The planning validator must evolve into shared-domain, adapter-contract, integration, and real desktop-runtime suites when executable code is introduced.",
    "Independent verification remains outstanding and may only be issued by ENG-15."
  ],
  "completedAt": "2026-08-03T17:30:00+03:30"
}
