{
  "schemaVersion": "1.0.0",
  "planId": "ENGPLAN-CYCLE-EVT-20260803-001",
  "workstreamId": "WS-08",
  "ownerRole": "ENG-08",
  "producerActorId": "actor-eng-08",
  "status": "completed",
  "verificationDisposition": "not_applicable",
  "implementationRevision": "80e5b2d6b1fb3a3efac1063eae1062a51a00f2d21f6fd70b77bd30412e8a08bc",
  "changedComponents": [
    "docs/platform-cloud-network/DEVREQ-CYCLE-EVT-20260803-001-platform-cloud-network-review.json"
  ],
  "commands": [
    "Get-Content -Raw 'C:\\Users\\sepehr\\.agents\\skills\\dan-agent-accuracy\\SKILL.md'; Get-Content -Raw '.development-os\\runs\\ENGPLAN-CYCLE-EVT-20260803-001-WS-08-input.json'",
    "Repository inspection using Get-ChildItem, git status --short, and reads of the WS-02 result, architecture record, coordination record, database-storage plan, package.json, and README.md",
    "Parsed the platform-cloud-network JSON with ConvertFrom-Json; validated identifiers, dependency status, zero required cloud services, three platform records, seven network policies, and five traceability groups; ran git diff --check and git diff --no-index --check; calculated SHA-256 and byte length; inspected artifact status",
    "Get-Date -Format o"
  ],
  "evidence": [
    "Created a machine-readable platform, cloud, and network review covering the local-first deployment model, network contract, resource guardrails, adversarial scenarios, platform delivery matrix, browser boundary, build and release gates, observability, costs, validation, traceability, and risks.",
    "The review preserves one shared download domain and transfer-service boundary consumed by platform, network, browser, packaging, and update adapters.",
    "Security review content covers TLS fail-closed behavior, scheme allow-listing, bounded redirects and retries, sensitive-log redaction, browser isolation, signing custody, provenance, SBOMs, dependency and secret scanning, rollback, and adversarial network testing.",
    "Validation passed: 3 platform records, 7 network policies, 6 adversarial scenarios, and 5 acceptance-traceability groups.",
    "git diff --check and the new-file whitespace check passed.",
    "Artifact SHA-256: faa6fb21731353e1413c6817bb9f041bed1b9e147fcdb428c5dbc0ce5c8568ea; size: 12803 bytes.",
    "No user-visible behavior was implemented, so DOM, browser, integration, or equivalent runtime testing was not applicable."
  ],
  "knownRisks": [
    "The first platform, supported versions, UI foundation, MVP boundary, and meaning of native remain unapproved.",
    "Network resource budgets and proxy, TLS, redirect, and range behaviors remain unspecified and unmeasured.",
    "Incorrect range or remote-identity handling could silently corrupt partial files without adversarial integration tests.",
    "Signing keys, package channels, update and rollback ownership, dependency policy, governance, and vulnerability reporting remain unresolved.",
    "No executable application or package exists, so platform, accessibility, resilience, performance, and release claims cannot be made.",
    "Independent verification remains outstanding and may only be issued by ENG-15."
  ],
  "completedAt": "2026-08-03T17:12:12.8067621+03:30"
}
