{
  "schemaVersion": "1.0.0",
  "planId": "ENGPLAN-CYCLE-EVT-20260803-002",
  "workstreamId": "WS-03",
  "ownerRole": "ENG-03",
  "producerActorId": "actor-eng-03",
  "status": "completed",
  "verificationDisposition": "not_applicable",
  "implementationRevision": "pending",
  "changedComponents": [
    "package.json",
    "src/index.html",
    "src/main.js",
    "src/formatters.js",
    "src/styles.css",
    "tests/frontend/formatters.test.js",
    "tests/frontend/serve-ui.js"
  ],
  "commands": [
    "Get-Content -Raw C:\\Users\\sepehr\\.agents\\skills\\dan-agent-accuracy\\SKILL.md; Get-Content -Raw .development-os\\runs\\ENGPLAN-CYCLE-EVT-20260803-002-WS-03-input.json",
    "git status --short; rg --files -g 'AGENTS.md' -g 'README*' -g 'package.json' -g 'src/**' -g 'app/**' -g 'apps/**' -g 'tests/**'",
    "Get-ChildItem -Recurse -File src,tests\\frontend | Select-Object -ExpandProperty FullName; Get-Content -Raw package.json; Get-Content -Raw .development-os\\runs\\ENGPLAN-CYCLE-EVT-20260803-002-WS-02-result.json",
    "Get-Content -Raw src\\index.html; Get-Content -Raw src\\main.js; Get-Content -Raw src\\formatters.js; Get-Content -Raw src\\styles.css; Get-Content -Raw tests\\frontend\\formatters.test.js; Get-Content -Raw tests\\frontend\\serve-ui.js",
    "Get-Content -Raw C:\\Users\\sepehr\\.codex\\skills\\playwright\\SKILL.md; Get-Content -Raw docs\\architecture\\DEVREQ-CYCLE-EVT-20260803-002-solution-architecture.json",
    "Get-Command npx | Select-Object -ExpandProperty Source; node --version; npm --version; playwright_cli.sh --help",
    "Applied a patch expanding tests/frontend/serve-ui.js with active, paused, failed, and completed runtime fixtures plus a clipboard URL offer event.",
    "Started tests/frontend/serve-ui.js detached and polled http://127.0.0.1:4317/?fixture=1 until ready.",
    "playwright_cli.sh -s=ws03 open http://127.0.0.1:4317/?fixture=1; playwright_cli.sh -s=ws03 snapshot",
    "playwright_cli.sh -s=ws03 reload; playwright_cli.sh -s=ws03 snapshot",
    "Playwright selected a destination, entered a URL, enabled file-type organization, submitted a download, dismissed the clipboard offer, paused an active download, captured runtime snapshots, and checked browser console errors.",
    "npm test; node --check src/main.js; node --check tests/frontend/serve-ui.js; git diff --check; git status --short; Get-Date -Format o",
    "playwright_cli.sh -s=ws03 close; stopped the detached tests/frontend/serve-ui.js process."
  ],
  "evidence": [
    "npm test passed 2 of 2 formatter and canonical-state-label tests with zero failures.",
    "node --check passed for src/main.js and tests/frontend/serve-ui.js.",
    "git diff --check completed without whitespace errors; its only output was an existing LF-to-CRLF warning for engineering/taskboard/workstreams.csv.",
    "Real Chromium DOM snapshots exposed labeled URL intake, destination selection, organization checkbox, clipboard confirmation, queue progress, transferred bytes, speed, ETA, failure alerts, and discernible download controls.",
    "The runtime fixture displayed active, paused, failed, and completed downloads with 50%, 25%, 0%, and 100% progress respectively; active speed rendered as 1.0 MB/s and ETA as About 5 sec left.",
    "Runtime interaction selected C:\\Users\\Tester\\Downloads, submitted https://example.com/manual.iso, and rendered manual.iso as Queued without reimplementing URL or destination business rules in the UI.",
    "Runtime interaction dismissed the clipboard offer without starting it and announced Clipboard suggestion dismissed.",
    "Runtime interaction paused example.zip and changed its visible state to Paused, replaced Pause with Resume, suppressed active speed and ETA, and announced example.zip: Paused.",
    "Playwright console inspection reported 0 errors and 0 warnings.",
    "The frontend consumes typed shell commands/events for list, submit, control, clipboard confirmation, destination selection, open-file, and reveal-in-folder operations; lifecycle and filesystem policy remain owned by the shared engine boundary."
  ],
  "knownRisks": [
    "The Tauri shell and shared Rust engine were not available in this workstream, so command compatibility against the native Windows application remains an integration dependency.",
    "Behavioral verification used a real Chromium DOM with a controlled bridge fixture, not the final Tauri WebView2 runtime or a Windows screen reader.",
    "Native destination picking, clipboard polling, open-file, and Explorer reveal require downstream Windows adapter verification.",
    "The authoritative write boundary excludes root Cargo.toml and LICENSE even though the overall request requires both.",
    "Independent engineering verification remains reserved for ENG-15."
  ],
  "completedAt": "2026-08-03T18:52:10.3349757+03:30"
}
