{
  "schemaVersion": "1.0.0",
  "planId": "ENGPLAN-CYCLE-EVT-20260803-001",
  "workstreamId": "WS-13",
  "ownerRole": "ENG-13",
  "producerActorId": "actor-eng-13",
  "status": "completed",
  "verificationDisposition": "not_applicable",
  "implementationRevision": "80e5b2d6b1fb3a3efac1063eae1062a51a00f2d21f6fd70b77bd30412e8a08bc",
  "changedComponents": [
    "docs/seo-web-discovery/DEVREQ-CYCLE-EVT-20260803-001-technical-seo-assessment.json"
  ],
  "commands": [
    "Get-Content -Raw -LiteralPath '.development-os\\runs\\ENGPLAN-CYCLE-EVT-20260803-001-WS-13-input.json'",
    "Get-ChildItem -Recurse -File | Where-Object { $_.FullName -notmatch '\\\\(node_modules|\\.git|secrets|production-data)(\\\\|$)' -and $_.Name -ne '.env' } | ForEach-Object { $_.FullName.Substring((Get-Location).Path.Length + 1) } | Select-Object -First 400",
    "Parsed docs\\seo-web-discovery\\DEVREQ-CYCLE-EVT-20260803-001-technical-seo-assessment.json with ConvertFrom-Json; asserted request/workstream identifiers, seven SEO checks, crawl/structured-data/Core-Web-Vitals coverage, and the shared-domain contract; calculated SHA-256 and byte length; ran git diff --check, scoped git status, and git diff --no-index --check",
    "Scanned the assessment for credential-like assignments and asserted its production-safety exclusion"
  ],
  "evidence": [
    "Created a machine-readable technical SEO assessment covering crawlability, indexing, status codes, canonicals, redirects, metadata, social previews, structured data, internal links, localization, pagination, mobile rendering, accessibility, and Core Web Vitals.",
    "Repository inspection found no application source, package manifest, HTML, web routes, robots.txt, sitemap, web manifest, runnable DOM, staging origin, or public web deployment to test.",
    "The assessment records each unavailable runtime check as not applicable, deferred, or not testable with a concrete follow-up trigger; it does not invent URLs, product claims, structured data, or ranking outcomes.",
    "The future web-surface contract requires adapters to consume the WS-02 shared download domain rather than duplicate download business rules.",
    "JSON validation passed with 7 technical SEO checks and 4 acceptance-traceability groups.",
    "git diff --check and the new-file whitespace check passed.",
    "Artifact SHA-256: acd0b60dbe791fe7b471a66b5957720c8b275672c0ff88709db2d4d7e1f0b1a0; size: 7997 bytes.",
    "Security scope review passed: no credential-like assignments were detected, and production/data access is explicitly excluded.",
    "No user-visible behavior was implemented, so a DOM, browser, integration, or equivalent runtime behavioral test was not applicable."
  ],
  "knownRisks": [
    "Crawlability, metadata rendering, structured-data validity, mobile behavior, accessibility, and Core Web Vitals remain unmeasurable until a real staging web surface exists.",
    "Product positioning, supported platforms, license, release ownership, canonical host, distribution URLs, localization, and indexing policies remain unresolved.",
    "A future public repository or release may be difficult to discover without an approved website or documentation information architecture.",
    "Premature platform or release claims could create misleading metadata or invalid structured data.",
    "Independent verification remains outstanding and may only be issued by ENG-15."
  ],
  "completedAt": "2026-08-03T17:21:13.9275644+03:30"
}
