{
  "schemaVersion": "1.0.0",
  "planId": "ENGPLAN-CYCLE-EVT-20260803-001",
  "workstreamId": "WS-02",
  "ownerRole": "ENG-02",
  "producerActorId": "actor-eng-02",
  "status": "completed",
  "verificationDisposition": "not_applicable",
  "implementationRevision": "80e5b2d6b1fb3a3efac1063eae1062a51a00f2d21f6fd70b77bd30412e8a08bc",
  "changedComponents": [
    "docs/architecture/DEVREQ-CYCLE-EVT-20260803-001-solution-architecture.json"
  ],
  "commands": [
    "Get-Content -Raw 'C:\\Users\\sepehr\\.agents\\skills\\dan-agent-accuracy\\SKILL.md'; Get-Content -Raw '.development-os\\runs\\ENGPLAN-CYCLE-EVT-20260803-001-WS-02-input.json'; if (Test-Path 'AGENTS.md') { Get-Content -Raw 'AGENTS.md' }; git status --short",
    "Get-Content -Raw 'docs\\engineering-coordination\\DEVREQ-CYCLE-EVT-20260803-001-workstream-sequence.json'; Get-ChildItem -Force; Get-ChildItem -Recurse -File -Include README*,package.json,*.md | Where-Object { $_.FullName -notmatch '\\.development-os|node_modules' } | Select-Object -ExpandProperty FullName",
    "Parsed the architecture JSON with ConvertFrom-Json; validated request ID, four architecture decisions, Windows/macOS/Linux coverage, shared download-domain topology, and ten capability-boundary entries; ran git diff --check and git diff --no-index --check; calculated SHA-256 and byte length; inspected artifact status."
  ],
  "evidence": [
    "Created a machine-readable solution-architecture record containing system impact analysis, four proposed architecture decisions with alternatives and trade-offs, shared-domain boundaries, component topology, platform impacts, capability scope, traceability, implementation notes, and risks.",
    "Architecture validation passed: 4 decisions, 3 platform records, 7 topology components, 10 capability classifications, and 6 acceptance-traceability groups.",
    "The design centralizes download state transitions and policies in one shared domain/service boundary consumed by UI and platform adapters.",
    "Architecture approval is explicitly blocked pending human product-owner decisions; the artifact makes no implementation, release, production, or independent-verification claim.",
    "git diff --check and the new-file whitespace check passed.",
    "Artifact SHA-256: b5aa5cf648d3123dec4894104ffd2fea168d76c2dad3828de9f897f17c7bebd6; size: 14082 bytes.",
    "No user-visible behavior was implemented, so DOM, browser, integration, or equivalent runtime testing was not applicable."
  ],
  "knownRisks": [
    "Primary segment, first platform, supported OS versions, bounded MVP, differentiation, exclusions, and meaning of “all devices” still require a dated human product-owner decision.",
    "Discovery evidence is unavailable, so the proposed foundation and capability boundaries cannot yet be approved.",
    "Incorrect range-response or remote-identity handling could corrupt resumed downloads; executable integrity scenarios are required downstream.",
    "Platform packaging, signing, updates, open-source governance, vulnerability reporting, and release ownership remain unresolved.",
    "Accessibility and resource-consumption outcomes require runtime testing on every approved platform.",
    "Only ENG-15 may issue the independent engineering verification disposition."
  ],
  "completedAt": "2026-08-03T16:57:27.7565766+03:30"
}
